{"action_schema":"lc-action/1","agents":[{"agent_id":"open-space","checkpoint_id":"open-space"},{"agent_id":"target","checkpoint_id":"step-300"}],"arena_index":24,"derived_streams":[{"initseq":"3480475676006549984","initstate":"15628582697299557124","label":"episode"},{"initseq":"11893492981069799388","initstate":"11491783620838406428","label":"agent/0"},{"initseq":"8883579565182948393","initstate":"13193092980408362962","label":"agent/1"}],"engine_version":"lc-engine/1","format":"lc-replay/1","initial_state":{"headings":["LEFT","UP"],"height":12,"positions":[{"x":7,"y":6},{"x":8,"y":1}],"trails":[[{"x":7,"y":6}],[{"x":8,"y":1}]],"width":12},"master_seed":"24","match_id":"open-space-24-1","observation_schema":"lc-observation/1","replay_sha256":"f2427839edd107acf5927b4d8d9b4dfeb473a3017d6658cec94c1061d49402e1","result":"draw","run_id":"lc-circuit-ai-selfplay-300-eval-step-300","tick_count":22,"ticks":[{"collision_causes":[[],[]],"joint_actions":[0,3],"terminal_causes":[],"tick":0},{"collision_causes":[[],[]],"joint_actions":[0,3],"terminal_causes":[],"tick":1},{"collision_causes":[[],[]],"joint_actions":[0,3],"terminal_causes":[],"tick":2},{"collision_causes":[[],[]],"joint_actions":[0,3],"terminal_causes":[],"tick":3},{"collision_causes":[[],[]],"joint_actions":[1,2],"terminal_causes":[],"tick":4},{"collision_causes":[[],[]],"joint_actions":[1,3],"terminal_causes":[],"tick":5},{"collision_causes":[[],[]],"joint_actions":[0,2],"terminal_causes":[],"tick":6},{"collision_causes":[[],[]],"joint_actions":[0,2],"terminal_causes":[],"tick":7},{"collision_causes":[[],[]],"joint_actions":[1,2],"terminal_causes":[],"tick":8},{"collision_causes":[[],[]],"joint_actions":[1,2],"terminal_causes":[],"tick":9},{"collision_causes":[[],[]],"joint_actions":[2,2],"terminal_causes":[],"tick":10},{"collision_causes":[[],[]],"joint_actions":[2,2],"terminal_causes":[],"tick":11},{"collision_causes":[[],[]],"joint_actions":[2,2],"terminal_causes":[],"tick":12},{"collision_causes":[[],[]],"joint_actions":[2,2],"terminal_causes":[],"tick":13},{"collision_causes":[[],[]],"joint_actions":[2,2],"terminal_causes":[],"tick":14},{"collision_causes":[[],[]],"joint_actions":[2,1],"terminal_causes":[],"tick":15},{"collision_causes":[[],[]],"joint_actions":[2,1],"terminal_causes":[],"tick":16},{"collision_causes":[[],[]],"joint_actions":[2,1],"terminal_causes":[],"tick":17},{"collision_causes":[[],[]],"joint_actions":[2,1],"terminal_causes":[],"tick":18},{"collision_causes":[[],[]],"joint_actions":[2,1],"terminal_causes":[],"tick":19},{"collision_causes":[[],[]],"joint_actions":[2,1],"terminal_causes":[],"tick":20},{"collision_causes":[["same_destination"],["same_destination"]],"joint_actions":[3,1],"terminal_causes":["agent_0_dead","agent_1_dead"],"tick":21}]}