{
  "action_schema": "lc-action/1",
  "agents": [
    {
      "agent_id": "open-space",
      "checkpoint_id": "open-space"
    },
    {
      "agent_id": "fixed-depth-rust",
      "checkpoint_id": "fixed-depth-rust-wasm-20261022"
    }
  ],
  "arena_index": 5615893441450766,
  "derived_streams": [
    {
      "initseq": "8127861497611118694",
      "initstate": "2481601282524576876",
      "label": "episode"
    },
    {
      "initseq": "16177870445111221170",
      "initstate": "186420681508255425",
      "label": "agent/0"
    },
    {
      "initseq": "17648753102747830717",
      "initstate": "11406373666464770325",
      "label": "agent/1"
    }
  ],
  "engine_version": "lc-engine/1",
  "format": "lc-replay/1",
  "initial_state": {
    "headings": [
      "UP",
      "DOWN"
    ],
    "height": 12,
    "positions": [
      {
        "x": 10,
        "y": 1
      },
      {
        "x": 2,
        "y": 9
      }
    ],
    "trails": [
      [
        {
          "x": 10,
          "y": 1
        }
      ],
      [
        {
          "x": 2,
          "y": 9
        }
      ]
    ],
    "width": 12
  },
  "master_seed": "5615893441450766",
  "match_id": "ind-open-space-d69feb58a3564faea462-5615893441450766-1",
  "observation_schema": "lc-observation/1",
  "replay_sha256": "779ed778e7b5b153cffdc678ff1e48bbcf712c6354db2c567e695076ce83f4cc",
  "result": "agent_1_win",
  "run_id": "ind-open-space-d69feb58a3564faea462",
  "tick_count": 24,
  "ticks": [
    {
      "collision_causes": [
        [],
        []
      ],
      "joint_actions": [
        0,
        1
      ],
      "terminal_causes": [],
      "tick": 0
    },
    {
      "collision_causes": [
        [],
        []
      ],
      "joint_actions": [
        1,
        1
      ],
      "terminal_causes": [],
      "tick": 1
    },
    {
      "collision_causes": [
        [],
        []
      ],
      "joint_actions": [
        2,
        0
      ],
      "terminal_causes": [],
      "tick": 2
    },
    {
      "collision_causes": [
        [],
        []
      ],
      "joint_actions": [
        2,
        1
      ],
      "terminal_causes": [],
      "tick": 3
    },
    {
      "collision_causes": [
        [],
        []
      ],
      "joint_actions": [
        2,
        0
      ],
      "terminal_causes": [],
      "tick": 4
    },
    {
      "collision_causes": [
        [],
        []
      ],
      "joint_actions": [
        2,
        1
      ],
      "terminal_causes": [],
      "tick": 5
    },
    {
      "collision_causes": [
        [],
        []
      ],
      "joint_actions": [
        2,
        0
      ],
      "terminal_causes": [],
      "tick": 6
    },
    {
      "collision_causes": [
        [],
        []
      ],
      "joint_actions": [
        2,
        0
      ],
      "terminal_causes": [],
      "tick": 7
    },
    {
      "collision_causes": [
        [],
        []
      ],
      "joint_actions": [
        2,
        1
      ],
      "terminal_causes": [],
      "tick": 8
    },
    {
      "collision_causes": [
        [],
        []
      ],
      "joint_actions": [
        2,
        2
      ],
      "terminal_causes": [],
      "tick": 9
    },
    {
      "collision_causes": [
        [],
        []
      ],
      "joint_actions": [
        2,
        2
      ],
      "terminal_causes": [],
      "tick": 10
    },
    {
      "collision_causes": [
        [],
        []
      ],
      "joint_actions": [
        2,
        2
      ],
      "terminal_causes": [],
      "tick": 11
    },
    {
      "collision_causes": [
        [],
        []
      ],
      "joint_actions": [
        2,
        2
      ],
      "terminal_causes": [],
      "tick": 12
    },
    {
      "collision_causes": [
        [],
        []
      ],
      "joint_actions": [
        3,
        1
      ],
      "terminal_causes": [],
      "tick": 13
    },
    {
      "collision_causes": [
        [],
        []
      ],
      "joint_actions": [
        0,
        1
      ],
      "terminal_causes": [],
      "tick": 14
    },
    {
      "collision_causes": [
        [],
        []
      ],
      "joint_actions": [
        0,
        0
      ],
      "terminal_causes": [],
      "tick": 15
    },
    {
      "collision_causes": [
        [],
        []
      ],
      "joint_actions": [
        0,
        0
      ],
      "terminal_causes": [],
      "tick": 16
    },
    {
      "collision_causes": [
        [],
        []
      ],
      "joint_actions": [
        0,
        0
      ],
      "terminal_causes": [],
      "tick": 17
    },
    {
      "collision_causes": [
        [],
        []
      ],
      "joint_actions": [
        0,
        0
      ],
      "terminal_causes": [],
      "tick": 18
    },
    {
      "collision_causes": [
        [],
        []
      ],
      "joint_actions": [
        0,
        0
      ],
      "terminal_causes": [],
      "tick": 19
    },
    {
      "collision_causes": [
        [],
        []
      ],
      "joint_actions": [
        0,
        0
      ],
      "terminal_causes": [],
      "tick": 20
    },
    {
      "collision_causes": [
        [],
        []
      ],
      "joint_actions": [
        0,
        0
      ],
      "terminal_causes": [],
      "tick": 21
    },
    {
      "collision_causes": [
        [],
        []
      ],
      "joint_actions": [
        0,
        3
      ],
      "terminal_causes": [],
      "tick": 22
    },
    {
      "collision_causes": [
        [
          "invalid_action"
        ],
        []
      ],
      "joint_actions": [
        "INVALID",
        3
      ],
      "terminal_causes": [
        "agent_0_dead"
      ],
      "tick": 23
    }
  ]
}
