{"action_schema":"lc-action/1","agents":[{"agent_id":"step-0","checkpoint_id":"step-0"},{"agent_id":"target","checkpoint_id":"step-0"}],"arena_index":31,"derived_streams":[{"initseq":"3751378489055378873","initstate":"6916193987540196836","label":"episode"},{"initseq":"1920259386350148988","initstate":"14036574375650024490","label":"agent/0"},{"initseq":"10728713955366258502","initstate":"12509072405922094922","label":"agent/1"}],"engine_version":"lc-engine/1","format":"lc-replay/1","initial_state":{"headings":["DOWN","UP"],"height":12,"positions":[{"x":3,"y":0},{"x":1,"y":0}],"trails":[[{"x":3,"y":0}],[{"x":1,"y":0}]],"width":12},"master_seed":"31","match_id":"step-0-31-1","observation_schema":"lc-observation/1","replay_sha256":"018b13e11066249ef096ab38f6fe5860a8c557bbc5f0b42e703f390aa0e1b458","result":"agent_0_win","run_id":"lc-circuit-ai-selfplay-300-step0-eval","tick_count":2,"ticks":[{"collision_causes":[[],[]],"joint_actions":[1,1],"terminal_causes":[],"tick":0},{"collision_causes":[[],["occupied_trail"]],"joint_actions":[1,1],"terminal_causes":["agent_1_dead"],"tick":1}]}