{"action_schema":"lc-action/1","agents":[{"agent_id":"candidate","checkpoint_id":"step-1000"},{"agent_id":"g007-step-300","checkpoint_id":"step-300"}],"arena_index":0,"derived_streams":[{"initseq":"9575905372967432348","initstate":"1610200437518141022","label":"episode"},{"initseq":"6197511875921560836","initstate":"6936255691490473095","label":"agent/0"},{"initseq":"12087773500535767283","initstate":"1765612635842935344","label":"agent/1"}],"engine_version":"lc-engine/1","format":"lc-replay/1","initial_state":{"headings":["UP","UP"],"height":12,"positions":[{"x":0,"y":8},{"x":6,"y":3}],"trails":[[{"x":0,"y":8}],[{"x":6,"y":3}]],"width":12},"master_seed":"12115123203809532599","match_id":"12115123203809532599-0-0","observation_schema":"lc-observation/1","replay_sha256":"5cc514b41250210fd4a88969c520435b052829e09f5f30444c1532bfe8f98633","result":"agent_1_win","run_id":"d5fecabc-d830-5efa-8fa9-ffa0d8918f07","tick_count":25,"ticks":[{"collision_causes":[[],[]],"joint_actions":[0,3],"terminal_causes":[],"tick":0},{"collision_causes":[[],[]],"joint_actions":[0,2],"terminal_causes":[],"tick":1},{"collision_causes":[[],[]],"joint_actions":[0,2],"terminal_causes":[],"tick":2},{"collision_causes":[[],[]],"joint_actions":[1,1],"terminal_causes":[],"tick":3},{"collision_causes":[[],[]],"joint_actions":[1,1],"terminal_causes":[],"tick":4},{"collision_causes":[[],[]],"joint_actions":[1,1],"terminal_causes":[],"tick":5},{"collision_causes":[[],[]],"joint_actions":[2,2],"terminal_causes":[],"tick":6},{"collision_causes":[[],[]],"joint_actions":[2,2],"terminal_causes":[],"tick":7},{"collision_causes":[[],[]],"joint_actions":[2,2],"terminal_causes":[],"tick":8},{"collision_causes":[[],[]],"joint_actions":[2,2],"terminal_causes":[],"tick":9},{"collision_causes":[[],[]],"joint_actions":[2,1],"terminal_causes":[],"tick":10},{"collision_causes":[[],[]],"joint_actions":[2,0],"terminal_causes":[],"tick":11},{"collision_causes":[[],[]],"joint_actions":[1,0],"terminal_causes":[],"tick":12},{"collision_causes":[[],[]],"joint_actions":[0,0],"terminal_causes":[],"tick":13},{"collision_causes":[[],[]],"joint_actions":[0,0],"terminal_causes":[],"tick":14},{"collision_causes":[[],[]],"joint_actions":[0,0],"terminal_causes":[],"tick":15},{"collision_causes":[[],[]],"joint_actions":[0,0],"terminal_causes":[],"tick":16},{"collision_causes":[[],[]],"joint_actions":[0,0],"terminal_causes":[],"tick":17},{"collision_causes":[[],[]],"joint_actions":[0,0],"terminal_causes":[],"tick":18},{"collision_causes":[[],[]],"joint_actions":[0,0],"terminal_causes":[],"tick":19},{"collision_causes":[[],[]],"joint_actions":[0,3],"terminal_causes":[],"tick":20},{"collision_causes":[[],[]],"joint_actions":[0,3],"terminal_causes":[],"tick":21},{"collision_causes":[[],[]],"joint_actions":[0,2],"terminal_causes":[],"tick":22},{"collision_causes":[[],[]],"joint_actions":[0,2],"terminal_causes":[],"tick":23},{"collision_causes":[["out_of_bounds"],[]],"joint_actions":[0,3],"terminal_causes":["agent_0_dead"],"tick":24}]}