{
  "action_schema": "lc-action/1",
  "agents": [
    {
      "agent_id": "candidate",
      "checkpoint_id": "step-236"
    },
    {
      "agent_id": "g007-step-300",
      "checkpoint_id": "step-300"
    }
  ],
  "arena_index": 0,
  "derived_streams": [
    {
      "initseq": "10819054603628924270",
      "initstate": "5488126461467450550",
      "label": "episode"
    },
    {
      "initseq": "5356760253250468258",
      "initstate": "13898582534770293784",
      "label": "agent/0"
    },
    {
      "initseq": "15232211754234243234",
      "initstate": "17891910714926923617",
      "label": "agent/1"
    }
  ],
  "engine_version": "lc-engine/1",
  "format": "lc-replay/1",
  "initial_state": {
    "headings": [
      "DOWN",
      "DOWN"
    ],
    "height": 12,
    "positions": [
      {
        "x": 10,
        "y": 2
      },
      {
        "x": 3,
        "y": 6
      }
    ],
    "trails": [
      [
        {
          "x": 10,
          "y": 2
        }
      ],
      [
        {
          "x": 3,
          "y": 6
        }
      ]
    ],
    "width": 12
  },
  "master_seed": "11194328648163483980",
  "match_id": "loss-11194328648163483980-0",
  "observation_schema": "lc-observation/1",
  "replay_sha256": "f17f7cc2fa072b2f8753cc799dc67e8c3963babb604d0901879910974c4ec9c4",
  "result": "agent_1_win",
  "run_id": "g008-v15-continuation-236",
  "tick_count": 26,
  "ticks": [
    {
      "collision_causes": [
        [],
        []
      ],
      "joint_actions": [
        3,
        2
      ],
      "terminal_causes": [],
      "tick": 0
    },
    {
      "collision_causes": [
        [],
        []
      ],
      "joint_actions": [
        3,
        1
      ],
      "terminal_causes": [],
      "tick": 1
    },
    {
      "collision_causes": [
        [],
        []
      ],
      "joint_actions": [
        2,
        1
      ],
      "terminal_causes": [],
      "tick": 2
    },
    {
      "collision_causes": [
        [],
        []
      ],
      "joint_actions": [
        1,
        1
      ],
      "terminal_causes": [],
      "tick": 3
    },
    {
      "collision_causes": [
        [],
        []
      ],
      "joint_actions": [
        1,
        0
      ],
      "terminal_causes": [],
      "tick": 4
    },
    {
      "collision_causes": [
        [],
        []
      ],
      "joint_actions": [
        2,
        0
      ],
      "terminal_causes": [],
      "tick": 5
    },
    {
      "collision_causes": [
        [],
        []
      ],
      "joint_actions": [
        3,
        3
      ],
      "terminal_causes": [],
      "tick": 6
    },
    {
      "collision_causes": [
        [],
        []
      ],
      "joint_actions": [
        3,
        3
      ],
      "terminal_causes": [],
      "tick": 7
    },
    {
      "collision_causes": [
        [],
        []
      ],
      "joint_actions": [
        2,
        3
      ],
      "terminal_causes": [],
      "tick": 8
    },
    {
      "collision_causes": [
        [],
        []
      ],
      "joint_actions": [
        2,
        3
      ],
      "terminal_causes": [],
      "tick": 9
    },
    {
      "collision_causes": [
        [],
        []
      ],
      "joint_actions": [
        2,
        3
      ],
      "terminal_causes": [],
      "tick": 10
    },
    {
      "collision_causes": [
        [],
        []
      ],
      "joint_actions": [
        2,
        3
      ],
      "terminal_causes": [],
      "tick": 11
    },
    {
      "collision_causes": [
        [],
        []
      ],
      "joint_actions": [
        2,
        0
      ],
      "terminal_causes": [],
      "tick": 12
    },
    {
      "collision_causes": [
        [],
        []
      ],
      "joint_actions": [
        3,
        0
      ],
      "terminal_causes": [],
      "tick": 13
    },
    {
      "collision_causes": [
        [],
        []
      ],
      "joint_actions": [
        3,
        0
      ],
      "terminal_causes": [],
      "tick": 14
    },
    {
      "collision_causes": [
        [],
        []
      ],
      "joint_actions": [
        3,
        0
      ],
      "terminal_causes": [],
      "tick": 15
    },
    {
      "collision_causes": [
        [],
        []
      ],
      "joint_actions": [
        3,
        1
      ],
      "terminal_causes": [],
      "tick": 16
    },
    {
      "collision_causes": [
        [],
        []
      ],
      "joint_actions": [
        3,
        1
      ],
      "terminal_causes": [],
      "tick": 17
    },
    {
      "collision_causes": [
        [],
        []
      ],
      "joint_actions": [
        3,
        1
      ],
      "terminal_causes": [],
      "tick": 18
    },
    {
      "collision_causes": [
        [],
        []
      ],
      "joint_actions": [
        3,
        1
      ],
      "terminal_causes": [],
      "tick": 19
    },
    {
      "collision_causes": [
        [],
        []
      ],
      "joint_actions": [
        3,
        1
      ],
      "terminal_causes": [],
      "tick": 20
    },
    {
      "collision_causes": [
        [],
        []
      ],
      "joint_actions": [
        0,
        1
      ],
      "terminal_causes": [],
      "tick": 21
    },
    {
      "collision_causes": [
        [],
        []
      ],
      "joint_actions": [
        1,
        1
      ],
      "terminal_causes": [],
      "tick": 22
    },
    {
      "collision_causes": [
        [],
        []
      ],
      "joint_actions": [
        0,
        1
      ],
      "terminal_causes": [],
      "tick": 23
    },
    {
      "collision_causes": [
        [],
        []
      ],
      "joint_actions": [
        0,
        1
      ],
      "terminal_causes": [],
      "tick": 24
    },
    {
      "collision_causes": [
        [
          "occupied_trail"
        ],
        []
      ],
      "joint_actions": [
        0,
        1
      ],
      "terminal_causes": [
        "agent_0_dead"
      ],
      "tick": 25
    }
  ]
}
