{
  "action_schema": "lc-action/1",
  "agents": [
    {
      "agent_id": "g007-step-300",
      "checkpoint_id": "step-300"
    },
    {
      "agent_id": "candidate",
      "checkpoint_id": "step-236"
    }
  ],
  "arena_index": 0,
  "derived_streams": [
    {
      "initseq": "15630968936113699567",
      "initstate": "3287306987768123933",
      "label": "episode"
    },
    {
      "initseq": "9248258677792461554",
      "initstate": "14981673115539434363",
      "label": "agent/0"
    },
    {
      "initseq": "16019728855328263535",
      "initstate": "13937000015943795502",
      "label": "agent/1"
    }
  ],
  "engine_version": "lc-engine/1",
  "format": "lc-replay/1",
  "initial_state": {
    "headings": [
      "UP",
      "RIGHT"
    ],
    "height": 12,
    "positions": [
      {
        "x": 7,
        "y": 7
      },
      {
        "x": 11,
        "y": 6
      }
    ],
    "trails": [
      [
        {
          "x": 7,
          "y": 7
        }
      ],
      [
        {
          "x": 11,
          "y": 6
        }
      ]
    ],
    "width": 12
  },
  "master_seed": "3189194872714192250",
  "match_id": "loss-3189194872714192250-1",
  "observation_schema": "lc-observation/1",
  "replay_sha256": "536a050f95584555d7b4d3a4bd99048b9ff5501079c2fd5b9d1a9fbcdb520b83",
  "result": "agent_0_win",
  "run_id": "g008-v15-continuation-236",
  "tick_count": 5,
  "ticks": [
    {
      "collision_causes": [
        [],
        []
      ],
      "joint_actions": [
        0,
        0
      ],
      "terminal_causes": [],
      "tick": 0
    },
    {
      "collision_causes": [
        [],
        []
      ],
      "joint_actions": [
        0,
        3
      ],
      "terminal_causes": [],
      "tick": 1
    },
    {
      "collision_causes": [
        [],
        []
      ],
      "joint_actions": [
        3,
        3
      ],
      "terminal_causes": [],
      "tick": 2
    },
    {
      "collision_causes": [
        [],
        []
      ],
      "joint_actions": [
        3,
        3
      ],
      "terminal_causes": [],
      "tick": 3
    },
    {
      "collision_causes": [
        [],
        [
          "occupied_trail"
        ]
      ],
      "joint_actions": [
        3,
        3
      ],
      "terminal_causes": [
        "agent_1_dead"
      ],
      "tick": 4
    }
  ]
}
