{"action_schema":"lc-action/1","agents":[{"agent_id":"open-space","checkpoint_id":"open-space"},{"agent_id":"target","checkpoint_id":"step-200"}],"arena_index":31,"derived_streams":[{"initseq":"3751378489055378873","initstate":"6916193987540196836","label":"episode"},{"initseq":"1920259386350148988","initstate":"14036574375650024490","label":"agent/0"},{"initseq":"10728713955366258502","initstate":"12509072405922094922","label":"agent/1"}],"engine_version":"lc-engine/1","format":"lc-replay/1","initial_state":{"headings":["DOWN","UP"],"height":12,"positions":[{"x":3,"y":0},{"x":1,"y":0}],"trails":[[{"x":3,"y":0}],[{"x":1,"y":0}]],"width":12},"master_seed":"31","match_id":"open-space-31-1","observation_schema":"lc-observation/1","replay_sha256":"f214ce67bc4884604a533e6d1ea337615662774e59ead77e9110e2d6c40b1cb9","result":"agent_0_win","run_id":"lc-circuit-ai-selfplay-300-eval-step-200","tick_count":16,"ticks":[{"collision_causes":[[],[]],"joint_actions":[1,1],"terminal_causes":[],"tick":0},{"collision_causes":[[],[]],"joint_actions":[1,2],"terminal_causes":[],"tick":1},{"collision_causes":[[],[]],"joint_actions":[1,2],"terminal_causes":[],"tick":2},{"collision_causes":[[],[]],"joint_actions":[1,2],"terminal_causes":[],"tick":3},{"collision_causes":[[],[]],"joint_actions":[1,2],"terminal_causes":[],"tick":4},{"collision_causes":[[],[]],"joint_actions":[1,2],"terminal_causes":[],"tick":5},{"collision_causes":[[],[]],"joint_actions":[1,2],"terminal_causes":[],"tick":6},{"collision_causes":[[],[]],"joint_actions":[1,1],"terminal_causes":[],"tick":7},{"collision_causes":[[],[]],"joint_actions":[2,1],"terminal_causes":[],"tick":8},{"collision_causes":[[],[]],"joint_actions":[2,1],"terminal_causes":[],"tick":9},{"collision_causes":[[],[]],"joint_actions":[2,1],"terminal_causes":[],"tick":10},{"collision_causes":[[],[]],"joint_actions":[2,1],"terminal_causes":[],"tick":11},{"collision_causes":[[],[]],"joint_actions":[2,1],"terminal_causes":[],"tick":12},{"collision_causes":[[],[]],"joint_actions":[2,1],"terminal_causes":[],"tick":13},{"collision_causes":[[],[]],"joint_actions":[2,1],"terminal_causes":[],"tick":14},{"collision_causes":[[],["occupied_trail"]],"joint_actions":[2,1],"terminal_causes":["agent_1_dead"],"tick":15}]}