{"action_schema":"lc-action/1","agents":[{"agent_id":"target","checkpoint_id":"step-200"},{"agent_id":"open-space","checkpoint_id":"open-space"}],"arena_index":5,"derived_streams":[{"initseq":"6126330204039506470","initstate":"3890723749016548523","label":"episode"},{"initseq":"1096796626143251257","initstate":"12176959213584309870","label":"agent/0"},{"initseq":"5131110118399791009","initstate":"13972088554124044669","label":"agent/1"}],"engine_version":"lc-engine/1","format":"lc-replay/1","initial_state":{"headings":["LEFT","UP"],"height":12,"positions":[{"x":3,"y":8},{"x":6,"y":10}],"trails":[[{"x":3,"y":8}],[{"x":6,"y":10}]],"width":12},"master_seed":"5","match_id":"open-space-05-0","observation_schema":"lc-observation/1","replay_sha256":"4bc8d598c0d9912d8826514a4359a8c7b5d882d9ee9d6605960f7d811c1db369","result":"agent_1_win","run_id":"lc-circuit-ai-selfplay-300-eval-step-200","tick_count":9,"ticks":[{"collision_causes":[[],[]],"joint_actions":[0,0],"terminal_causes":[],"tick":0},{"collision_causes":[[],[]],"joint_actions":[0,0],"terminal_causes":[],"tick":1},{"collision_causes":[[],[]],"joint_actions":[0,0],"terminal_causes":[],"tick":2},{"collision_causes":[[],[]],"joint_actions":[0,0],"terminal_causes":[],"tick":3},{"collision_causes":[[],[]],"joint_actions":[0,0],"terminal_causes":[],"tick":4},{"collision_causes":[[],[]],"joint_actions":[0,0],"terminal_causes":[],"tick":5},{"collision_causes":[[],[]],"joint_actions":[1,0],"terminal_causes":[],"tick":6},{"collision_causes":[[],[]],"joint_actions":[1,0],"terminal_causes":[],"tick":7},{"collision_causes":[["occupied_head"],[]],"joint_actions":[1,0],"terminal_causes":["agent_0_dead"],"tick":8}]}