{"action_schema":"lc-action/1","agents":[{"agent_id":"open-space","checkpoint_id":"open-space"},{"agent_id":"target","checkpoint_id":"step-1"}],"arena_index":7,"derived_streams":[{"initseq":"7213534137209414182","initstate":"17800183494109255820","label":"episode"},{"initseq":"11878340852880229965","initstate":"13510736427238970176","label":"agent/0"},{"initseq":"12057362156352976862","initstate":"5188322836423619245","label":"agent/1"}],"engine_version":"lc-engine/1","format":"lc-replay/1","initial_state":{"headings":["DOWN","RIGHT"],"height":12,"positions":[{"x":1,"y":5},{"x":8,"y":1}],"trails":[[{"x":1,"y":5}],[{"x":8,"y":1}]],"width":12},"master_seed":"7","match_id":"open-space-07-1","observation_schema":"lc-observation/1","replay_sha256":"0ffa467e2a3f8900f7e04bc5e7c2ecfdfa9dccfa7cc50a1bdb7ed777cff16b37","result":"agent_0_win","run_id":"lc-circuit-ai-smoke-r4","tick_count":4,"ticks":[{"collision_causes":[[],[]],"joint_actions":[1,1],"terminal_causes":[],"tick":0},{"collision_causes":[[],[]],"joint_actions":[0,1],"terminal_causes":[],"tick":1},{"collision_causes":[[],[]],"joint_actions":[0,1],"terminal_causes":[],"tick":2},{"collision_causes":[[],["out_of_bounds"]],"joint_actions":[0,1],"terminal_causes":["agent_1_dead"],"tick":3}]}