{"action_schema":"lc-action/1","agents":[{"agent_id":"step-0","checkpoint_id":"step-0"},{"agent_id":"target","checkpoint_id":"step-200"}],"arena_index":16,"derived_streams":[{"initseq":"2049319050567671414","initstate":"15920865964734141598","label":"episode"},{"initseq":"4703300110219542124","initstate":"3025812592223159356","label":"agent/0"},{"initseq":"15879536487816190799","initstate":"12568447782695616511","label":"agent/1"}],"engine_version":"lc-engine/1","format":"lc-replay/1","initial_state":{"headings":["RIGHT","LEFT"],"height":12,"positions":[{"x":0,"y":1},{"x":11,"y":10}],"trails":[[{"x":0,"y":1}],[{"x":11,"y":10}]],"width":12},"master_seed":"16","match_id":"step-0-16-1","observation_schema":"lc-observation/1","replay_sha256":"e23670df78a1f5cdcf1e3660d1861caf5af95c1eb17b326746010734f264dfc6","result":"agent_1_win","run_id":"lc-circuit-ai-selfplay-300-eval-step-200","tick_count":12,"ticks":[{"collision_causes":[[],[]],"joint_actions":[1,3],"terminal_causes":[],"tick":0},{"collision_causes":[[],[]],"joint_actions":[1,3],"terminal_causes":[],"tick":1},{"collision_causes":[[],[]],"joint_actions":[1,3],"terminal_causes":[],"tick":2},{"collision_causes":[[],[]],"joint_actions":[1,3],"terminal_causes":[],"tick":3},{"collision_causes":[[],[]],"joint_actions":[1,3],"terminal_causes":[],"tick":4},{"collision_causes":[[],[]],"joint_actions":[1,3],"terminal_causes":[],"tick":5},{"collision_causes":[[],[]],"joint_actions":[1,3],"terminal_causes":[],"tick":6},{"collision_causes":[[],[]],"joint_actions":[1,3],"terminal_causes":[],"tick":7},{"collision_causes":[[],[]],"joint_actions":[1,0],"terminal_causes":[],"tick":8},{"collision_causes":[[],[]],"joint_actions":[1,0],"terminal_causes":[],"tick":9},{"collision_causes":[[],[]],"joint_actions":[1,0],"terminal_causes":[],"tick":10},{"collision_causes":[["out_of_bounds"],[]],"joint_actions":[1,0],"terminal_causes":["agent_0_dead"],"tick":11}]}