{"action_schema":"lc-action/1","agents":[{"agent_id":"target","checkpoint_id":"step-1"},{"agent_id":"open-space","checkpoint_id":"open-space"}],"arena_index":0,"derived_streams":[{"initseq":"13682310872408897968","initstate":"13097817001650409514","label":"episode"},{"initseq":"6269683043135904314","initstate":"1970325947257326680","label":"agent/0"},{"initseq":"14398943070561256881","initstate":"16630946482191805918","label":"agent/1"}],"engine_version":"lc-engine/1","format":"lc-replay/1","initial_state":{"headings":["RIGHT","LEFT"],"height":12,"positions":[{"x":3,"y":4},{"x":10,"y":3}],"trails":[[{"x":3,"y":4}],[{"x":10,"y":3}]],"width":12},"master_seed":"0","match_id":"open-space-00-0","observation_schema":"lc-observation/1","replay_sha256":"25924c554981f5668c063435f0af2adaac01c4817979c3a1226b3942af96d526","result":"draw","run_id":"lc-circuit-ai-smoke-r4","tick_count":8,"ticks":[{"collision_causes":[[],[]],"joint_actions":[1,0],"terminal_causes":[],"tick":0},{"collision_causes":[[],[]],"joint_actions":[1,0],"terminal_causes":[],"tick":1},{"collision_causes":[[],[]],"joint_actions":[1,0],"terminal_causes":[],"tick":2},{"collision_causes":[[],[]],"joint_actions":[1,1],"terminal_causes":[],"tick":3},{"collision_causes":[[],[]],"joint_actions":[1,2],"terminal_causes":[],"tick":4},{"collision_causes":[[],[]],"joint_actions":[1,2],"terminal_causes":[],"tick":5},{"collision_causes":[[],[]],"joint_actions":[1,2],"terminal_causes":[],"tick":6},{"collision_causes":[["same_destination"],["same_destination"]],"joint_actions":[1,2],"terminal_causes":["agent_0_dead","agent_1_dead"],"tick":7}]}