{"action_schema":"lc-action/1","agents":[{"agent_id":"target","checkpoint_id":"step-0"},{"agent_id":"step-0","checkpoint_id":"step-0"}],"arena_index":30,"derived_streams":[{"initseq":"2217724428698484234","initstate":"2396955738860255397","label":"episode"},{"initseq":"11022649804206896452","initstate":"18292701637112419853","label":"agent/0"},{"initseq":"17233786152515882265","initstate":"9734038068716900449","label":"agent/1"}],"engine_version":"lc-engine/1","format":"lc-replay/1","initial_state":{"headings":["DOWN","DOWN"],"height":12,"positions":[{"x":9,"y":10},{"x":9,"y":9}],"trails":[[{"x":9,"y":10}],[{"x":9,"y":9}]],"width":12},"master_seed":"30","match_id":"step-0-30-0","observation_schema":"lc-observation/1","replay_sha256":"07ab8520746069c86284c2c43f0e75b5e4cf57b3b7abac0fffa9a14054c815e0","result":"draw","run_id":"lc-circuit-ai-selfplay-300-step0-eval","tick_count":3,"ticks":[{"collision_causes":[[],[]],"joint_actions":[1,1],"terminal_causes":[],"tick":0},{"collision_causes":[[],[]],"joint_actions":[1,1],"terminal_causes":[],"tick":1},{"collision_causes":[["out_of_bounds"],["out_of_bounds"]],"joint_actions":[1,1],"terminal_causes":["agent_0_dead","agent_1_dead"],"tick":2}]}