{"action_schema":"lc-action/1","agents":[{"agent_id":"target","checkpoint_id":"step-100"},{"agent_id":"step-0","checkpoint_id":"step-0"}],"arena_index":5,"derived_streams":[{"initseq":"6126330204039506470","initstate":"3890723749016548523","label":"episode"},{"initseq":"1096796626143251257","initstate":"12176959213584309870","label":"agent/0"},{"initseq":"5131110118399791009","initstate":"13972088554124044669","label":"agent/1"}],"engine_version":"lc-engine/1","format":"lc-replay/1","initial_state":{"headings":["LEFT","UP"],"height":12,"positions":[{"x":3,"y":8},{"x":6,"y":10}],"trails":[[{"x":3,"y":8}],[{"x":6,"y":10}]],"width":12},"master_seed":"5","match_id":"step-0-05-0","observation_schema":"lc-observation/1","replay_sha256":"39d3558b116f23537724d4c52cf71eac3e59303f359489350ac37464ab30df42","result":"agent_0_win","run_id":"lc-circuit-ai-selfplay-300-eval-step-100","tick_count":6,"ticks":[{"collision_causes":[[],[]],"joint_actions":[0,1],"terminal_causes":[],"tick":0},{"collision_causes":[[],[]],"joint_actions":[0,1],"terminal_causes":[],"tick":1},{"collision_causes":[[],[]],"joint_actions":[1,1],"terminal_causes":[],"tick":2},{"collision_causes":[[],[]],"joint_actions":[1,1],"terminal_causes":[],"tick":3},{"collision_causes":[[],[]],"joint_actions":[1,1],"terminal_causes":[],"tick":4},{"collision_causes":[[],["out_of_bounds"]],"joint_actions":[0,1],"terminal_causes":["agent_1_dead"],"tick":5}]}