{"action_schema":"lc-action/1","agents":[{"agent_id":"step-0","checkpoint_id":"step-0"},{"agent_id":"target","checkpoint_id":"step-1"}],"arena_index":11,"derived_streams":[{"initseq":"15948031412423014751","initstate":"4612970229540091636","label":"episode"},{"initseq":"16307720672331949940","initstate":"7850589505375945706","label":"agent/0"},{"initseq":"13228464439882987631","initstate":"11878367717135375029","label":"agent/1"}],"engine_version":"lc-engine/1","format":"lc-replay/1","initial_state":{"headings":["LEFT","UP"],"height":12,"positions":[{"x":7,"y":7},{"x":5,"y":6}],"trails":[[{"x":7,"y":7}],[{"x":5,"y":6}]],"width":12},"master_seed":"11","match_id":"step-0-11-1","observation_schema":"lc-observation/1","replay_sha256":"edc0df1d7c27cd351fa9c6e1740326ac40f8c0e0084e4345281e775134ae6593","result":"agent_1_win","run_id":"lc-circuit-ai-smoke-r4","tick_count":1,"ticks":[{"collision_causes":[["reverse_action"],[]],"joint_actions":[1,1],"terminal_causes":["agent_0_dead"],"tick":0}]}