{"action_schema":"lc-action/1","agents":[{"agent_id":"step-0","checkpoint_id":"step-0"},{"agent_id":"target","checkpoint_id":"step-1"}],"arena_index":27,"derived_streams":[{"initseq":"15593754297442279676","initstate":"16835038836417795107","label":"episode"},{"initseq":"670346623125252462","initstate":"13765790465031885930","label":"agent/0"},{"initseq":"4201537800658587175","initstate":"15865360824435430409","label":"agent/1"}],"engine_version":"lc-engine/1","format":"lc-replay/1","initial_state":{"headings":["RIGHT","DOWN"],"height":12,"positions":[{"x":3,"y":3},{"x":3,"y":7}],"trails":[[{"x":3,"y":3}],[{"x":3,"y":7}]],"width":12},"master_seed":"27","match_id":"step-0-27-1","observation_schema":"lc-observation/1","replay_sha256":"e368bca4330988f06db83aebda1d138458b564e65cb9eb22c69c935ec032059f","result":"draw","run_id":"lc-circuit-ai-smoke-r4","tick_count":9,"ticks":[{"collision_causes":[[],[]],"joint_actions":[1,1],"terminal_causes":[],"tick":0},{"collision_causes":[[],[]],"joint_actions":[1,1],"terminal_causes":[],"tick":1},{"collision_causes":[[],[]],"joint_actions":[1,1],"terminal_causes":[],"tick":2},{"collision_causes":[[],[]],"joint_actions":[1,1],"terminal_causes":[],"tick":3},{"collision_causes":[[],[]],"joint_actions":[1,1],"terminal_causes":[],"tick":4},{"collision_causes":[[],[]],"joint_actions":[1,1],"terminal_causes":[],"tick":5},{"collision_causes":[[],[]],"joint_actions":[1,1],"terminal_causes":[],"tick":6},{"collision_causes":[[],[]],"joint_actions":[1,1],"terminal_causes":[],"tick":7},{"collision_causes":[["out_of_bounds"],["out_of_bounds"]],"joint_actions":[1,1],"terminal_causes":["agent_0_dead","agent_1_dead"],"tick":8}]}