{"action_schema":"lc-action/1","agents":[{"agent_id":"target","checkpoint_id":"step-0"},{"agent_id":"open-space","checkpoint_id":"open-space"}],"arena_index":31,"derived_streams":[{"initseq":"3751378489055378873","initstate":"6916193987540196836","label":"episode"},{"initseq":"1920259386350148988","initstate":"14036574375650024490","label":"agent/0"},{"initseq":"10728713955366258502","initstate":"12509072405922094922","label":"agent/1"}],"engine_version":"lc-engine/1","format":"lc-replay/1","initial_state":{"headings":["DOWN","UP"],"height":12,"positions":[{"x":3,"y":0},{"x":1,"y":0}],"trails":[[{"x":3,"y":0}],[{"x":1,"y":0}]],"width":12},"master_seed":"31","match_id":"open-space-31-0","observation_schema":"lc-observation/1","replay_sha256":"ba8b1abcd39fdd3cd59fbffe95b3f9c0950e2c83abb053696f3d490cb472c583","result":"agent_1_win","run_id":"lc-circuit-ai-selfplay-300-step0-eval","tick_count":9,"ticks":[{"collision_causes":[[],[]],"joint_actions":[1,1],"terminal_causes":[],"tick":0},{"collision_causes":[[],[]],"joint_actions":[1,2],"terminal_causes":[],"tick":1},{"collision_causes":[[],[]],"joint_actions":[1,1],"terminal_causes":[],"tick":2},{"collision_causes":[[],[]],"joint_actions":[1,1],"terminal_causes":[],"tick":3},{"collision_causes":[[],[]],"joint_actions":[1,1],"terminal_causes":[],"tick":4},{"collision_causes":[[],[]],"joint_actions":[1,1],"terminal_causes":[],"tick":5},{"collision_causes":[[],[]],"joint_actions":[1,1],"terminal_causes":[],"tick":6},{"collision_causes":[[],[]],"joint_actions":[1,1],"terminal_causes":[],"tick":7},{"collision_causes":[["out_of_bounds"],[]],"joint_actions":[1,1],"terminal_causes":["agent_0_dead"],"tick":8}]}